{
  "binary_manifests": [
    {
      "artifact_path": "binaries/reference-php-php",
      "binary_id": "reference-php",
      "configure_args": [
        "--disable-all",
        "--enable-cli"
      ],
      "git_commit": "47355da494ba696b1bdb6d10448a225e742bd316",
      "git_tree": "e51a84a0ed6a97a49277af006f2524556ae6d07c",
      "role": "reference",
      "sha256": "493ebaca4a493802d019d4cba7d4ba0d4abc9c673bff23f4650b16818580a334",
      "toolchain": "Apple clang version 21.0.0 (clang-2100.1.1.101)"
    },
    {
      "artifact_path": "binaries/candidate-debug-nts-php",
      "binary_id": "candidate-debug-nts",
      "configure_args": [
        "--profile",
        "w05-debug-nts"
      ],
      "git_commit": "4e304ffb41a03e555ca7dc290edf7a1466ec5c14",
      "git_tree": "de3e3897b2c474d7975e9680719ce8f8180d2690",
      "role": "candidate",
      "sha256": "423859d4df84388d160c018fc513ab84c7d33788b8b6fcd3088efbb2e2cdfa0d",
      "toolchain": "Apple clang version 21.0.0 (clang-2100.1.1.101)"
    },
    {
      "artifact_path": "binaries/candidate-debug-zts-php",
      "binary_id": "candidate-debug-zts",
      "configure_args": [
        "--profile",
        "w05-debug-zts"
      ],
      "git_commit": "4e304ffb41a03e555ca7dc290edf7a1466ec5c14",
      "git_tree": "de3e3897b2c474d7975e9680719ce8f8180d2690",
      "role": "candidate",
      "sha256": "f0bba1bf952897b46a255cadbd5243c679cc2c0c8cb30023dd5083862ea5cf3f",
      "toolchain": "Apple clang version 21.0.0 (clang-2100.1.1.101)"
    },
    {
      "artifact_path": "binaries/candidate-asan-nts-php",
      "binary_id": "candidate-asan-nts",
      "configure_args": [
        "--profile",
        "w05-asan-nts"
      ],
      "git_commit": "4e304ffb41a03e555ca7dc290edf7a1466ec5c14",
      "git_tree": "de3e3897b2c474d7975e9680719ce8f8180d2690",
      "role": "candidate",
      "sha256": "f4ab340b9a0ced3ddb53ceaeedb7a452c6f7c9a3cbb3819f103c86f7153a1793",
      "toolchain": "Apple clang version 21.0.0 (clang-2100.1.1.101)"
    },
    {
      "artifact_path": "binaries/candidate-ubsan-nts-php",
      "binary_id": "candidate-ubsan-nts",
      "configure_args": [
        "--profile",
        "w05-ubsan-nts"
      ],
      "git_commit": "4e304ffb41a03e555ca7dc290edf7a1466ec5c14",
      "git_tree": "de3e3897b2c474d7975e9680719ce8f8180d2690",
      "role": "candidate",
      "sha256": "fa4e886fea2876740fafd660f8504c7e1277e347d1fb138e2d31fe2029e5a714",
      "toolchain": "Apple clang version 21.0.0 (clang-2100.1.1.101)"
    }
  ],
  "capability_ids": [
    "abstract_call_effects",
    "callee_entry_descriptor",
    "caller_frame_descriptor",
    "direct_user_call_sequence",
    "reducible_control_flow",
    "scalar_semantics"
  ],
  "codegen_eligible": false,
  "command_summaries": [
    {
      "command_id": "build-debug-nts",
      "path": "tests/native/calls/integration/commands/build-debug-nts.json",
      "sha256": "40c168a6d61080eb12a05e1128bf40ecf491dd7eda60a1853c5a66ed7dbf9fb0"
    },
    {
      "command_id": "build-debug-zts",
      "path": "tests/native/calls/integration/commands/build-debug-zts.json",
      "sha256": "2e26e599cc05d4ebf28cab77efa724c6676dba7c622d19ffe98bfaa330a20d3d"
    },
    {
      "command_id": "build-w05-asan-nts",
      "path": "tests/native/calls/integration/commands/build-w05-asan-nts.json",
      "sha256": "6fd6014477b6e6c1c0bc7e579ccbbb5a9d591a1f2452f3e0457d189cf5fbcff0"
    },
    {
      "command_id": "build-w05-debug-nts",
      "path": "tests/native/calls/integration/commands/build-w05-debug-nts.json",
      "sha256": "7a7b053cc38bdc39ce3ccff03e426440759d980fbcac99f0dccc4d91733727f7"
    },
    {
      "command_id": "build-w05-debug-zts",
      "path": "tests/native/calls/integration/commands/build-w05-debug-zts.json",
      "sha256": "3b03d3a3d2b45584dc380d69375eec94325ba9840de4f40295a08a5d3c84643e"
    },
    {
      "command_id": "build-w05-ubsan-nts",
      "path": "tests/native/calls/integration/commands/build-w05-ubsan-nts.json",
      "sha256": "3e50bcbf33755edb2697cd042d0be806c2d2e387f5d7370d8bfd0131715fedf3"
    },
    {
      "command_id": "calls-unittest",
      "path": "tests/native/calls/integration/commands/calls-unittest.json",
      "sha256": "64b0e1e2afc09ba12be43bd04e5c3c4f2cce7623adbc68ca1bde52ecffef7e37"
    },
    {
      "command_id": "check-contract",
      "path": "tests/native/calls/integration/commands/check-contract.json",
      "sha256": "7e90452ef9ea7c94ffcb62247ddbdaa410afcdc23c0013fdbba7d0fcfa3ca33a"
    },
    {
      "command_id": "check-phase-history",
      "path": "tests/native/calls/integration/commands/check-phase-history.json",
      "sha256": "ae38afe7d01d3d047a4b2bf74290d06c2c21a091537557032920ded0d6f10e26"
    },
    {
      "command_id": "check-phases",
      "path": "tests/native/calls/integration/commands/check-phases.json",
      "sha256": "c08d8869b7b94c9e8c18347786a574e2d12834ea9f390dd5db2844fd756d5520"
    },
    {
      "command_id": "check-reviews",
      "path": "tests/native/calls/integration/commands/check-reviews.json",
      "sha256": "e13d53c1331eb2482abb124b6794f2f1a789081e14e51ec335a1d8fcfc1f88fe"
    },
    {
      "command_id": "fuzz-20000",
      "path": "tests/native/calls/integration/commands/fuzz-20000.json",
      "sha256": "efb49983678560507e11b615a6c8165767135e1baf5cf6d248d2b91d082e0199"
    },
    {
      "command_id": "smoke-debug-nts",
      "path": "tests/native/calls/integration/commands/smoke-debug-nts.json",
      "sha256": "cc9945af1260247158837105236eb67588b08b3f75bf1e0700d5353185208c50"
    },
    {
      "command_id": "smoke-debug-zts",
      "path": "tests/native/calls/integration/commands/smoke-debug-zts.json",
      "sha256": "f9efe6280642edfbeeb6f74161e3661841e7c3fcbb43f0d66f018503b7bf980a"
    },
    {
      "command_id": "test-w05-asan-nts",
      "path": "tests/native/calls/integration/commands/test-w05-asan-nts.json",
      "sha256": "38722b4889c3583a09f8bb8dbd3fd06b328ef31f8633e17ec7bbd01d0bd53f61"
    },
    {
      "command_id": "test-w05-debug-nts",
      "path": "tests/native/calls/integration/commands/test-w05-debug-nts.json",
      "sha256": "a82cf874f6fa241b3045270d147e9a2e50a3b34a7b5a846ed78c7a113d884c30"
    },
    {
      "command_id": "test-w05-debug-zts",
      "path": "tests/native/calls/integration/commands/test-w05-debug-zts.json",
      "sha256": "e3ffe7e111ff0ecb3892f76485df3d02e7069bd0eafaa0636dd4ca659c1824a5"
    },
    {
      "command_id": "test-w05-ubsan-nts",
      "path": "tests/native/calls/integration/commands/test-w05-ubsan-nts.json",
      "sha256": "aa88a953f63a0caabbceb9732b5da2d52381b4ebf09d2294d031fa8adc097f44"
    },
    {
      "command_id": "validate-w01",
      "path": "tests/native/calls/integration/commands/validate-w01.json",
      "sha256": "a9bb347c93336813bf05b7b753df9bf106f8150243c0dbb7d83bcb3781bbb764"
    },
    {
      "command_id": "validate-w02",
      "path": "tests/native/calls/integration/commands/validate-w02.json",
      "sha256": "b96fa35ab9a6c5f8bec1a2dd37cdca417857adadf29cc83c69597ddb5c29a9e4"
    },
    {
      "command_id": "validate-w03",
      "path": "tests/native/calls/integration/commands/validate-w03.json",
      "sha256": "4dae9f07effb3b1a6101f5ab7b3d878bdf3cc54fac08f95a5cf853125b000c1d"
    },
    {
      "command_id": "validate-w04",
      "path": "tests/native/calls/integration/commands/validate-w04.json",
      "sha256": "79ed842ef582cf82521b40d656b85cd6647278100836162049b35e83a0a7a9fd"
    },
    {
      "command_id": "validate-w05",
      "path": "tests/native/calls/integration/commands/validate-w05.json",
      "sha256": "7c81205fc29e1d3f2dc14f89d3cbf05fe9462ba061fe2ce713864d59b14424c6"
    },
    {
      "command_id": "verify-w04",
      "path": "tests/native/calls/integration/commands/verify-w04.json",
      "sha256": "9a5b0a9f295e4131fe5e13f1420d72519acc659fe326d87f32b8a60019d86f2b"
    },
    {
      "command_id": "waves-unittest",
      "path": "tests/native/calls/integration/commands/waves-unittest.json",
      "sha256": "40822215b67c0c4e3fad3c5bc8846fa309affc75deeda066a7037d1facc894a3"
    }
  ],
  "coverage": {
    "path": "docs/native-engine/calls/w05-coverage-report.json",
    "sha256": "530f1e489e7f25d8ec46de3ab9d43067a3945692a33db9e38229fc8428930e38"
  },
  "definition": {
    "path": "docs/native-engine/waves/waves.json",
    "sha256": "972ad0180969f032125e4e73fc2a5f4c5ab9793348fedbc7eab138efed5a0edb"
  },
  "dependency_receipts": [
    {
      "path": "docs/native-engine/waves/receipts/W04.json",
      "sha256": "7648662dd4a7676d6cf2d145bc870b1ad63f000705fa75bf99cd6d1cdd23fb0a",
      "wave_id": "W04"
    }
  ],
  "format_version": "2.0.0",
  "phase_receipts": [
    {
      "changed_paths": [
        "Zend/Native/Calls/Contracts/zend_mir_call_source.h",
        "Zend/Native/MIR/zend_mir_call.h",
        "Zend/Native/MIR/zend_mir_capability.h",
        "Zend/Native/MIR/zend_mir_verification.h",
        "docs/native-engine/adr/0021-w05-v2-evidence-and-capability-registry.md",
        "docs/native-engine/calls/contracts/call-sequence.md",
        "docs/native-engine/calls/w05-phase-manifest.json",
        "docs/native-engine/calls/w05-sequence-profile.json",
        "docs/native-engine/roadmap/capability-registry.json",
        "docs/native-engine/roadmap/capability-registry.schema.json",
        "docs/native-engine/waves/schemas/codex-task-result.schema.json",
        "docs/native-engine/waves/schemas/command-summary.schema.json",
        "docs/native-engine/waves/schemas/phase-receipt.schema.json",
        "docs/native-engine/waves/schemas/review-evidence.schema.json",
        "docs/native-engine/waves/schemas/wave-receipt-v2.schema.json",
        "scripts/native/calls/check-contract.py",
        "scripts/native/calls/check-phases.py",
        "scripts/native/check-phase-history.py",
        "scripts/native/verify-wave-receipt.py",
        "scripts/native/wave-gate.py",
        "tests/native/calls/contracts/call-sequence-fixtures.json",